{
  "beatmapId": "yt:dQw4w9WgXcQ/g1/easy/standard",
  "songId": "yt:dQw4w9WgXcQ",
  "generatorVersion": 1,
  "difficulty": "easy",
  "mode": "standard",
  "laneCount": 4,
  "notes": [
    { "t": 0.60, "lane": 0, "type": "tap" },
    { "t": 1.66, "lane": 1, "type": "tap" },
    { "t": 2.72, "lane": 2, "type": "tap" },
    { "t": 3.78, "lane": 3, "type": "tap" },
    { "t": 4.84, "lane": 1, "type": "hold", "dur": 1.6 },
    { "t": 6.97, "lane": 2, "type": "tap" },
    { "t": 8.03, "lane": 0, "type": "tap" },
    { "t": 9.09, "lane": 3, "type": "tap" },
    { "t": 10.15, "lane": 1, "type": "tap" },
    { "t": 11.21, "lane": 2, "type": "hold", "dur": 1.6 },
    { "t": 13.34, "lane": 0, "type": "tap" },
    { "t": 14.40, "lane": 3, "type": "tap" },
    { "t": 15.46, "lane": 1, "type": "tap" },
    { "t": 16.52, "lane": 2, "type": "tap" },
    { "t": 17.58, "lane": 0, "type": "hold", "dur": 2.1 },
    { "t": 20.24, "lane": 3, "type": "tap" }
  ]
}
